{
  "campaignSlug": "synthetic-complete",
  "readiness": "card_ready",
  "communityName": "Synthetic Complete Community",
  "campaignGoal": "Exercise the every required field without relying on Green Goods campaign copy.",
  "vaultStory": "A synthetic deployed Octant vault used only to test portability of manifests and implementation plans.",
  "impactFraming": "Synthetic supporters can understand the vault, review the asset and receiver semantics, and manage a position in the target route.",
  "ctaLabels": {
    "browse": "View synthetic vault",
    "walletEndow": "Endow with wallet",
    "cardEndow": "Endow with card",
    "manage": "Manage position"
  },
  "riskNotes": [
    "Synthetic data is for dry-run planning only.",
    "No live value movement should use this fixture."
  ],
  "sourceLinks": [
    {
      "label": "Synthetic vault explorer",
      "url": "https://etherscan.io/address/0x1111111111111111111111111111111111111111"
    },
    {
      "label": "Synthetic asset explorer",
      "url": "https://etherscan.io/address/0x222222222222222222222222222222222222222"
    }
  ],
  "vault": {
    "chainId": 1,
    "vaultAddress": "0x1111111111111111111111111111111111111111",
    "vaultDisplayName": "Synthetic Octant Vault",
    "vaultTokenSymbol": "synWETH",
    "vaultDecimals": 18,
    "assetAddress": "0x2222222222222222222222222222222222222222",
    "assetSymbol": "WETH",
    "assetDecimals": 18,
    "explorerLink": "https://etherscan.io/address/0x1111111111111111111111111111111111111111",
    "assetExplorerLink": "https://etherscan.io/address/0x2222222222222222222222222222222222222222"
  },
  "factoryEvidence": {
    "name": "SyntheticFactory",
    "address": "0x3333333333333333333333333333333333333333",
    "evidenceType": "synthetic_fixture_only",
    "proofLimit": "Not a real factory and never valid for create-vault implementation."
  },
  "campaignCopy": "Synthetic transaction-ready campaign copy for a deployed Octant vault.",
  "recipientRoutingSummary": "Synthetic recipient routing summary for dry-run planning.",
  "positionRead": {
    "ownerSource": "connected_or_recovered_wallet",
    "shareRead": "balanceOf(owner)",
    "redeemRead": "maxRedeem(owner)"
  },
  "indexerSupport": {
    "status": "not_required",
    "endpoint": null
  },
  "cardProvider": {
    "adapter": "thirdweb",
    "status": "interface_only",
    "receiverProof": "user_owned_recovered_wallet_required",
    "tupleProof": "chain_asset_amount_receiver_vault_provider_route_match_required",
    "shareProof": "vault_balanceOf_receiver_required",
    "secrets": "backend_only"
  },
  "createVaultOperatorModule": {
    "status": "blocked_synthetic_only",
    "checklistPath": "references/create-vault-operator-module.md"
  },
  "runtime": {
    "framework": "react",
    "router": "target_repo_router",
    "walletStack": "target_repo_wallet_stack",
    "rpcPolicy": "target_repo_rpc_policy",
    "chainSwitching": "require_exact_configured_chain",
    "validationCommands": [
      "target repo unit tests for readiness and transaction shape",
      "target repo provider adapter tests with mocked proof",
      "target repo browser proof before live value movement"
    ]
  },
  "privacy": {
    "urlSafeFields": ["campaignSlug"],
    "publicLogPolicy": "redact provider sessions, receipt tokens, emails, OTPs, and wallet-specific recovery identifiers",
    "privateFields": ["email", "otp", "providerSessionId", "receiptToken", "webhookSecret"]
  },
  "missingFields": [],
  "proofLimits": [
    "Synthetic fixture proves portability only and must not be used for live transactions."
  ]
}
