{
  "campaignSlug": "greenpill-nyc",
  "readiness": "card_ready",
  "communityName": "Greenpill NYC",
  "campaignGoal": "Support the Greenpill NYC Octant vault campaign.",
  "vaultStory": "Greenpill NYC uses an Octant vault to let supporters endow a project-aligned vault position rather than make a one-time donation.",
  "impactFraming": "Supporters can help sustain local public-goods coordination while retaining a vault-share position that can be managed from the campaign route.",
  "ctaLabels": {
    "browse": "View Greenpill NYC vault",
    "walletEndow": "Endow with wallet",
    "cardEndow": "Endow with card",
    "manage": "Manage position"
  },
  "riskNotes": [
    "The pilot vault asset is WETH on Ethereum mainnet; primary donor copy may say ETH contribution only with WETH settlement detail.",
    "Factory evidence is creator/strategy-factory metadata, not proven MultistrategyVaultFactory deployment proof.",
    "Live card-funded value movement and positive share proof remain human-gated outside automated validation."
  ],
  "sourceLinks": [
    {
      "label": "Vault explorer",
      "url": "https://etherscan.io/address/0xaC8F844CEA2Fd75B7A5514f11974895B334fd9A5"
    },
    {
      "label": "WETH explorer",
      "url": "https://etherscan.io/address/0xC02aaA39b223FE8D0A0e5C4F27eAD9083C756Cc2"
    }
  ],
  "vault": {
    "chainId": 1,
    "vaultAddress": "0xaC8F844CEA2Fd75B7A5514f11974895B334fd9A5",
    "vaultDisplayName": "Greenpill NYC",
    "vaultTokenSymbol": "gpWETH",
    "vaultDecimals": 18,
    "assetAddress": "0xC02aaA39b223FE8D0A0e5C4F27eAD9083C756Cc2",
    "assetSymbol": "WETH",
    "assetDecimals": 18,
    "explorerLink": "https://etherscan.io/address/0xaC8F844CEA2Fd75B7A5514f11974895B334fd9A5",
    "assetExplorerLink": "https://etherscan.io/address/0xC02aaA39b223FE8D0A0e5C4F27eAD9083C756Cc2"
  },
  "factoryEvidence": {
    "name": "YearnV3StrategyFactory",
    "address": "0x9A6c9aA80D4A0d8Da29EcbA62c40ccBBB321abB6",
    "evidenceType": "pilot_strategy_factory_creator",
    "proofLimit": "Creator/strategy-factory evidence only; not a proven MultistrategyVaultFactory accessor return."
  },
  "campaignCopy": "Endow the Greenpill NYC Octant vault with a WETH-settled contribution and review the configured vault, asset, and receiver before authorizing any transaction.",
  "recipientRoutingSummary": "Use the project-approved Greenpill NYC routing summary from the target campaign brief before public launch.",
  "positionRead": {
    "ownerSource": "connected_or_recovered_wallet",
    "shareRead": "balanceOf(owner)",
    "redeemRead": "maxRedeem(owner)"
  },
  "indexerSupport": null,
  "cardProvider": {
    "adapter": "thirdweb",
    "status": "proof_gated_reference_path",
    "receiverProof": "user_owned_recovered_wallet_required",
    "tupleProof": "chain_asset_amount_receiver_vault_provider_route_match_required",
    "shareProof": "vault_balanceOf_receiver_required",
    "secrets": "backend_only"
  },
  "createVaultOperatorModule": {
    "status": "not_needed_existing_vault",
    "checklistPath": "references/create-vault-operator-module.md"
  },
  "runtime": {
    "framework": "react",
    "router": "target_repo_router",
    "walletStack": "target_repo_wallet_stack",
    "rpcPolicy": "target_repo_rpc_policy",
    "chainSwitching": "require_ethereum_mainnet",
    "validationCommands": [
      "target repo unit tests for readiness and transaction shape",
      "target repo browser proof before live value movement"
    ]
  },
  "privacy": {
    "urlSafeFields": ["campaignSlug"],
    "publicLogPolicy": "redact provider sessions, receipt tokens, emails, OTPs, and wallet-specific recovery identifiers",
    "privateFields": ["email", "otp", "providerSessionId", "receiptToken", "webhookSecret"]
  },
  "missingFields": [],
  "proofLimits": [
    "Live card-funded value movement and positive mainnet share proof are not performed by automated validation.",
    "Factory evidence is not create-vault authorization proof."
  ]
}
